{
  "$id": "https://tokenpilot.dev/schemas/batch-ingestion-response.schema.json",
  "$schema": "https://json-schema.org/draft/2020-12/schema",
  "type": "object",
  "properties": {
    "schema_version": {
      "$ref": "#/$defs/__schema0"
    },
    "batch_id": {
      "$ref": "#/$defs/__schema1"
    },
    "received_at": {
      "$ref": "#/$defs/__schema2"
    },
    "accepted": {
      "$ref": "#/$defs/__schema3"
    },
    "duplicates": {
      "$ref": "#/$defs/__schema3"
    },
    "conflicts": {
      "$ref": "#/$defs/__schema3"
    },
    "rejected": {
      "$ref": "#/$defs/__schema3"
    },
    "results": {
      "$ref": "#/$defs/__schema4"
    }
  },
  "required": [
    "schema_version",
    "batch_id",
    "received_at",
    "accepted",
    "duplicates",
    "conflicts",
    "rejected",
    "results"
  ],
  "additionalProperties": false,
  "title": "Batch Ingestion Response",
  "description": "Per-batch accepted, duplicate, conflict, and rejected usage-event results.",
  "$defs": {
    "__schema0": {
      "type": "string",
      "const": "2.0"
    },
    "__schema1": {
      "anyOf": [
        {
          "type": "string",
          "pattern": "^[0-9A-HJKMNP-TV-Z]{26}$"
        },
        {
          "type": "string",
          "pattern": "^[0-9a-f]{8}-[0-9a-f]{4}-7[0-9a-f]{3}-[89ab][0-9a-f]{3}-[0-9a-f]{12}$"
        }
      ]
    },
    "__schema2": {
      "type": "string",
      "pattern": "^\\d{4}-\\d{2}-\\d{2}T\\d{2}:\\d{2}:\\d{2}(?:\\.\\d{1,9})?Z$"
    },
    "__schema3": {
      "type": "integer",
      "minimum": 0,
      "maximum": 9007199254740991
    },
    "__schema4": {
      "type": "array",
      "items": {
        "type": "object",
        "properties": {
          "index": {
            "$ref": "#/$defs/__schema3"
          },
          "event_id": {
            "anyOf": [
              {
                "$ref": "#/$defs/__schema1"
              },
              {
                "type": "null"
              }
            ]
          },
          "status": {
            "type": "string",
            "enum": [
              "accepted",
              "duplicate",
              "conflict",
              "rejected"
            ]
          },
          "code": {
            "anyOf": [
              {
                "type": "string",
                "maxLength": 120,
                "pattern": "^[A-Z][A-Z0-9_]*$"
              },
              {
                "type": "null"
              }
            ]
          },
          "message": {
            "anyOf": [
              {
                "type": "string",
                "minLength": 1,
                "maxLength": 500
              },
              {
                "type": "null"
              }
            ]
          }
        },
        "required": [
          "index",
          "event_id",
          "status"
        ],
        "additionalProperties": false
      }
    }
  }
}
